Event	tone	value
Accuse of human rights abuses	-1.0	17.16041841152515
Confiscate property	-2.7	13.169214539172478
Threaten with violent repression	-7.7	11.695317006580835
Appeal for material cooperation, not specified below	0.51	9.392147161295094
Engage in judicial cooperation	-2.7	7.867029863038522
Demobilize armed forces	-3.6	7.423846779109937
Grant diplomatic recognition	-2.9	6.478041133006162
Ban political parties or politicians	-4.3	6.161626745077823
Express intent to provide diplomatic cooperation such as policy support	3.3	6.05154043896455
Appeal for humanitarian aid	2.5	6.0145780955696475
Demand de-escalation of military engagement106:[-5.0] Demand withdrawal	1.1	5.810648006434149
Express intent to provide humanitarian aid	3.7	4.586589766943858
Torture	-1.1	4.3822548210816015
Demand change in leadership	-4.6	4.285098646518533
Express intent to accept mediation	2.9	3.9657986393805422
Expel or deport individuals	-4.9	3.8582609736538935
Appeal for release of persons or property	-5.3	3.780709890253654
Ease economic sanctions, boycott, embargo	-2.7	3.62735039516632
Impose curfew	1.1	3.4161205023873324
Reduce or break diplomatic relations	1.8	3.3711715484085514
Threaten conventional attack  	-5.6	3.3119855159328844
Protest violently, riot	-4.8	3.3058522094218974
Demand rights	-5.5	3.085991210139817
Grant asylum	3.6	2.9781010867361184
Assassinate 	-1.5	2.7655275965620794
Cooperate militarily	-2.5	2.670069694675542
Provide military protection or peacekeeping	-3.4	2.6212202284556616
Accede to demands for rights	2.9	2.571659341783181
Appeal for judicial cooperation	0.68	2.544926916192919
Demand release of persons or property	-1.0	2.535263748751386
Investigate crime, corruption	-1.0	2.444146116516727
Reduce or stop aid, not specified below	3.6	2.3774252525246324
Demand intelligence cooperation	-2.4	2.3301583376055723
Demonstrate military or police power, not specified below	-1.3	2.2862752000413273
Engage in political dissent, not specified below	-6.1	2.270233395194351
Abduct, hijack, or take hostage 	-3.1	1.9357285470396202
Express intent to provide economic aid	-0.0	1.8547118889224152
Accuse of crime, corruption	-4.8	1.8361647700331911
Cooperate economically	0.027	1.8331256406815348
Rally opposition against	1.7	1.8318903591950693
Express intent to cooperate economically	1.5	1.8069523733310064
Physically assault, not specified below	-5.4	1.7814868281537044
Appeal for diplomatic cooperation, such as policy support	2.9	1.7567219018070288
Sign formal agreement	1.8	1.5980782037462498
Occupy territory	-2.6	1.5209227090650803
Engage in diplomatic cooperation, not specified below	1.3	1.50452990542522
Return, release person(s)	-1.9	1.5029252526501304
Use conventional military force, not specified below	-3.1	1.4610039200221054
Use tactics of violent repression  	-8.2	1.4592037907548538
Yield, not specified below 	-2.3	1.4418339458091955
Use unconventional violence, not specified below	-4.3	1.4354342773999098
Arrest, detain, or charge with legal action 	-3.2	1.4121206339017585
Reduce relations, not specified below	-4.2	1.3927924930719529
Seize or damage property, not specified below	-2.5	1.3836961341621636
Provide military aid	1.3	1.3739249085970657
Reject request or demand for material aid, not specified below	-2.4	1.3667024711821296
Mobilize or increase police power	-10.27	1.3451756557019714
Apologize	-5.6	1.2576471027624596
Meet at a ÒhirdÓlocation	3.5	1.2454203730724787
Expel or withdraw, not specified below	-1.0	1.2373077965183228
Impose administrative sanctions, not specified below	-1.0	1.2023882703537756
Accuse, not specified below	-4.7	1.1789566105172817
Appeal to yield	-4.4	1.1736431895386328
Decline comment	0.71	1.1587246689413873
Express intent to provide matyerial aid, not specified below	0.99	1.1496278940386535
Engage in negotiation	0.31	1.144187421790487
Express intent to yield, not specified below	2.4	1.1082932065991797
Conduct strike or boycott, not specified below	-4.8	1.0975282546522362
Express intent to cooperate, not specified below	0.28	1.0872535290566505
Fight with small arms and light weapons	-2.5	1.0854279053947087
Host a visit	0.052	1.042490130620609
Make a visit	-0.0	0.9995181241845301
Threaten political dissent, protest	-8.1	0.9979156358876039
Provide humanitarian aid	-1.0	0.9955286586051427
Acknowledge or claim responsibility	-3.6	0.9937300879627607
Threaten to use military force, not specified below	-1.3	0.9886833653318862
Consult, not specified below	-1.0	0.981490494981331
Appeal for change in leadership	-4.7	0.9664025105437848
Engage in material cooperation, not specified below	-0.0	0.9501414687108567
Reject plan, agreement to settle dispute	-1.3	0.9484322159262351
Criticize or denounce 	-2.7	0.9480834812372626
Express intent to provide military aid	-6.7	0.9380152081906468
Return, release property	-6.1	0.9372969729623232
Appeal to others to meet or negotiate	0.63	0.9212229176905405
Share intelligence or information	1.7	0.9208449197759233
Sexually assault	-7.0	0.9120239402705128
Mobilize or increase armed forces 	-4.8	0.9064794480811568
Engage in mass killings	-8.1	0.8760328101303393
Accede to demands for change in leadership	-5.4	0.8717548419853729
Make pessimistic comment	-2.2	0.8676653392002778
Demonstrate or rally	-2.4	0.8659963149880439
Express intent to release persons or property	0.094	0.8631636009087748
Investigate, not specified below	-2.4	0.858042304808153
Employ aerial weapons	-6.0	0.8572769552612778
Make statement, not specified below	-1.5	0.854521863691879
Accuse of aggression	1.8	0.8523452570654246
Express intent to engage in material cooperation,  not specified below	0.52	0.8478780799931618
Demand, not specified below	-2.3	0.8409273048010951
Express intent to settle dispute	-4.2	0.8397735056177412
Appeal to others to settle dispute	-1.1	0.8226544668607487
Refuse to release persons or property	-4.0	0.8074603210348246
Express intent to meet or negotiate	0.61	0.8015805577016574
Discuss by telephone	-3.9	0.7975234269725747
Appeal for intelligence	-4.2	0.785105192959141
Complain officially 	-2.3	0.7787783989113312
Reject, not specified below	-1.5	0.7686335598302555
Engage in symbolic act	1.1	0.7648137162750712
Return, release, not specified below	-1.0	0.758607475315979
Provide aid, not specified below	0.15	0.7416992415691508
Appeal, not specified below	-1.0	0.7189576138830743
Threaten, not specified below	-2.4	0.7086898459036935
Destroy property	-2.6	0.698427071142332
Rally support on behalf of	-4.3	0.6939398223859377
Make optimistic comment	-3.1	0.6927965074140148
Provide economic aid	-1.4	0.6645403176308843
Mediate	-2.5	0.6628753682430293
Make empathetic comment	-3.2	0.658926566436945
Fight with artillery and tanks	-7.2	0.6477533290333458
Impose restrictions on political freedoms  	-5.6	0.6395558237663501
Accuse of war crimes	-7.4	0.6309844570560794
Consider policy option	-1.7	0.6164557323223651
Accede to requests or demands for political reform not specified below	3.7	0.6157494198635785
Praise or endorse	1.3	0.6127024212117517
Carry out suicide bombing	-8.2	0.6126675909353324
Retreat or surrender militarily	-3.4	0.5483953617660542
Ease administrative sanctions, not specified below	-1.5	0.5469892497332682
Disapprove, not specified below	-1.3	0.5161880977945377
Threaten non-force, not specified below	1.8	0.5082105646369197
Impose embargo, boycott, or sanctions	-5.8	0.5009088215058264
Impose blockade, restrict movement 	0.36	0.48808207603221454
Declare truce, ceasefire	-1.0	0.4726292844358278
Defend verbally	-2.9	0.45973078869133477
Deny responsibility	-1.0	0.45356066777271087
Defy norms, law	-5.5	0.2826390779701672
Appeal for aid, not specified below	-1.5	0.15087631635441176
Reject proposal to meet, discuss, or negotiate	-4.5	0.12731693038643677
